#CODE;ENGLISH;FRENCH;GERMAN;;SPANISH;;;;;;;;;x
claim_king_silvan_elves;Claim the High Kingship of the Silvans;;;;;;;;;;;;;x
claim_king_silvan_elves_desc;As the ruler of all the Wood Elves, you may claim the title of High King of the Silvan Elves.;;;;;;;;;;;;;x
claim_king_anadune;Claim the High Kingship of Anadûnê;;;;;;;;;;;;;x
claim_king_anadune_desc;As ruler over all the Black Númenoreans, you may claim the title of High King of the Anadûnê.;;;;;;;;;;;;;x
claim_king_arnor;Claim the High Kingship of Arnor;;;;;;;;;;;;;x
claim_king_arnor_desc;As ruler over Arthedain and either Cardolan or Rhudaur, you may claim the title of High King of Arnor.;;;;;;;;;;;;;x
claim_king_gondor;Claim the Crown of Gondor;Réclamer la Couronne du Gondor;;;;;;;;;;;;x
claim_king_gondor_desc;If the last heir of Isildur is dead, you can claim the crown of Gondor for yourself as the Steward of Gondor.;Si le dernier héritier d'Isildur est mort, vous pouvez réclamer la Couronne du Gondor.;;;;;;;;;;;;x